[{"format":"raa.prims","version":0,"id":"refused-base","name":"Refused base","budget":{"triangles":1500,"segments":16},"nodes":[{"id":"crate","kind":"box","params":{"size":[1,1,1]},"transform":{"t":[0,0,0],"r":[0,0,0,1],"s":[1,1,1]},"material":"wood","op":"union"}],"materials":{"wood":{"color":[0.5,0.3,0.1],"roughness":0.8,"metallic":0,"emissive":[0,0,0]}},"anchors":{},"collision":{"mode":"override","colliders":[]}}]
