{
  "format": "raa.prims",
  "version": 0,
  "id": "torus-ring",
  "name": "Torus ring",
  "budget": {
    "triangles": 1500,
    "segments": 16
  },
  "nodes": [
    {
      "id": "ring",
      "kind": "torus",
      "params": {
        "majorRadius": 0.6,
        "minorRadius": 0.25
      },
      "transform": {
        "t": [0, 0.25, 0],
        "r": [0, 0, 0, 1],
        "s": [1, 1, 1]
      },
      "material": "rubber",
      "op": "union"
    }
  ],
  "materials": {
    "rubber": {
      "color": [0.75, 0.1, 0.15],
      "roughness": 0.5,
      "metallic": 0,
      "emissive": [0, 0, 0]
    }
  },
  "anchors": {
    "bounce": {
      "t": [0, 0.5, 0],
      "r": [0, 0, 0, 1]
    }
  },
  "collision": {
    "mode": "derived",
    "colliders": [
      {
        "node": "ring",
        "shape": "capsule",
        "params": {
          "halfHeight": 0.22961,
          "radius": 0.25
        },
        "t": [0.6, 0.25, 0],
        "r": [0.707107, 0, 0, 0.707107]
      },
      {
        "node": "ring",
        "shape": "capsule",
        "params": {
          "halfHeight": 0.22961,
          "radius": 0.25
        },
        "t": [0.424264, 0.25, 0.424264],
        "r": [0.5, 0, 0.5, 0.707107]
      },
      {
        "node": "ring",
        "shape": "capsule",
        "params": {
          "halfHeight": 0.22961,
          "radius": 0.25
        },
        "t": [0, 0.25, 0.6],
        "r": [0, 0, 0.707107, 0.707107]
      },
      {
        "node": "ring",
        "shape": "capsule",
        "params": {
          "halfHeight": 0.22961,
          "radius": 0.25
        },
        "t": [-0.424264, 0.25, 0.424264],
        "r": [-0.5, 0, 0.5, 0.707107]
      },
      {
        "node": "ring",
        "shape": "capsule",
        "params": {
          "halfHeight": 0.22961,
          "radius": 0.25
        },
        "t": [-0.6, 0.25, 0],
        "r": [-0.707107, 0, 0, 0.707107]
      },
      {
        "node": "ring",
        "shape": "capsule",
        "params": {
          "halfHeight": 0.22961,
          "radius": 0.25
        },
        "t": [-0.424264, 0.25, -0.424264],
        "r": [-0.5, 0, -0.5, 0.707107]
      },
      {
        "node": "ring",
        "shape": "capsule",
        "params": {
          "halfHeight": 0.22961,
          "radius": 0.25
        },
        "t": [0, 0.25, -0.6],
        "r": [0, 0, -0.707107, 0.707107]
      },
      {
        "node": "ring",
        "shape": "capsule",
        "params": {
          "halfHeight": 0.22961,
          "radius": 0.25
        },
        "t": [0.424264, 0.25, -0.424264],
        "r": [0.5, 0, -0.5, 0.707107]
      }
    ]
  }
}
