{
  "format": "raa.prims",
  "version": 0,
  "id": "bool_no_host",
  "name": "bool no host",
  "budget": {
    "triangles": 1500,
    "segments": 16
  },
  "nodes": [
    {
      "id": "hole",
      "kind": "sphere",
      "params": {
        "radius": 0.5
      },
      "transform": {
        "t": [0, 0, 0],
        "r": [0, 0, 0, 1],
        "s": [1, 1, 1]
      },
      "material": "plain",
      "op": "subtract"
    }
  ],
  "materials": {
    "plain": {
      "color": [0.5, 0.5, 0.5],
      "roughness": 0.5,
      "metallic": 0,
      "emissive": [0, 0, 0]
    }
  },
  "anchors": {},
  "collision": {
    "mode": "override",
    "colliders": []
  }
}
