{
  "format": "raa.prims",
  "version": 0,
  "id": "nested-union",
  "name": "Nested union under a scaled, rotated root",
  "budget": {
    "triangles": 1500,
    "segments": 16
  },
  "nodes": [
    {
      "id": "root_box",
      "kind": "box",
      "params": {
        "size": [1, 0.5, 1]
      },
      "transform": {
        "t": [0, 1, 0],
        "r": [0, 0.382683, 0, 0.92388],
        "s": [2, 2, 2]
      },
      "material": "stone",
      "op": "union",
      "children": [
        {
          "id": "top_ball",
          "kind": "sphere",
          "params": {
            "radius": 0.25
          },
          "transform": {
            "t": [0, 0.5, 0],
            "r": [0, 0, 0, 1],
            "s": [1, 1, 1]
          },
          "material": "paint",
          "op": "union"
        },
        {
          "id": "arm",
          "kind": "capsule",
          "params": {
            "height": 0.6,
            "radius": 0.1
          },
          "transform": {
            "t": [0.4, 0.3, 0],
            "r": [0, 0, 0, 1],
            "s": [1.5, 1.5, 1.5]
          },
          "material": "paint",
          "op": "union",
          "children": [
            {
              "id": "knob",
              "kind": "sphere",
              "params": {
                "radius": 0.12
              },
              "transform": {
                "t": [0, 0.3, 0],
                "r": [0, 0, 0, 1],
                "s": [1, 1, 1]
              },
              "material": "stone",
              "op": "union"
            }
          ]
        }
      ]
    }
  ],
  "materials": {
    "paint": {
      "color": [0.8, 0.2, 0.1],
      "roughness": 0.4,
      "metallic": 0,
      "emissive": [0, 0, 0]
    },
    "stone": {
      "color": [0.5, 0.5, 0.5],
      "roughness": 0.9,
      "metallic": 0,
      "emissive": [0, 0, 0]
    }
  },
  "anchors": {},
  "collision": {
    "mode": "derived",
    "colliders": [
      {
        "node": "root_box",
        "shape": "cuboid",
        "params": {
          "halfExtents": [1, 0.5, 1]
        },
        "t": [0, 1, 0],
        "r": [0, 0.382683, 0, 0.92388]
      },
      {
        "node": "top_ball",
        "shape": "ball",
        "params": {
          "radius": 0.5
        },
        "t": [0, 2, 0],
        "r": [0, 0.382683, 0, 0.92388]
      },
      {
        "node": "arm",
        "shape": "capsule",
        "params": {
          "halfHeight": 0.6,
          "radius": 0.3
        },
        "t": [0.565686, 1.6, -0.565685],
        "r": [0, 0.382683, 0, 0.92388]
      },
      {
        "node": "knob",
        "shape": "ball",
        "params": {
          "radius": 0.36
        },
        "t": [0.565686, 2.5, -0.565685],
        "r": [0, 0.382683, 0, 0.92388]
      }
    ]
  }
}
