{
  "format": "raa.prims",
  "version": 0,
  "id": "cap_anchors",
  "name": "cap anchors",
  "budget": {
    "triangles": 1500,
    "segments": 16
  },
  "nodes": [
    {
      "id": "host",
      "kind": "box",
      "params": {
        "size": [6, 4, 2]
      },
      "transform": {
        "t": [0, 0, 0],
        "r": [0, 0, 0, 1],
        "s": [1, 1, 1]
      },
      "material": "plain",
      "op": "union"
    }
  ],
  "materials": {
    "plain": {
      "color": [0.5, 0.5, 0.5],
      "roughness": 0.5,
      "metallic": 0,
      "emissive": [0, 0, 0]
    }
  },
  "anchors": {
    "anchor0": {
      "t": [0, 0, 0],
      "r": [0, 0, 0, 1]
    },
    "anchor1": {
      "t": [0, 0, 0],
      "r": [0, 0, 0, 1]
    },
    "anchor2": {
      "t": [0, 0, 0],
      "r": [0, 0, 0, 1]
    },
    "anchor3": {
      "t": [0, 0, 0],
      "r": [0, 0, 0, 1]
    },
    "anchor4": {
      "t": [0, 0, 0],
      "r": [0, 0, 0, 1]
    },
    "anchor5": {
      "t": [0, 0, 0],
      "r": [0, 0, 0, 1]
    },
    "anchor6": {
      "t": [0, 0, 0],
      "r": [0, 0, 0, 1]
    },
    "anchor7": {
      "t": [0, 0, 0],
      "r": [0, 0, 0, 1]
    },
    "anchor8": {
      "t": [0, 0, 0],
      "r": [0, 0, 0, 1]
    },
    "anchor9": {
      "t": [0, 0, 0],
      "r": [0, 0, 0, 1]
    },
    "anchor10": {
      "t": [0, 0, 0],
      "r": [0, 0, 0, 1]
    },
    "anchor11": {
      "t": [0, 0, 0],
      "r": [0, 0, 0, 1]
    },
    "anchor12": {
      "t": [0, 0, 0],
      "r": [0, 0, 0, 1]
    },
    "anchor13": {
      "t": [0, 0, 0],
      "r": [0, 0, 0, 1]
    },
    "anchor14": {
      "t": [0, 0, 0],
      "r": [0, 0, 0, 1]
    },
    "anchor15": {
      "t": [0, 0, 0],
      "r": [0, 0, 0, 1]
    },
    "anchor16": {
      "t": [0, 0, 0],
      "r": [0, 0, 0, 1]
    },
    "anchor17": {
      "t": [0, 0, 0],
      "r": [0, 0, 0, 1]
    },
    "anchor18": {
      "t": [0, 0, 0],
      "r": [0, 0, 0, 1]
    },
    "anchor19": {
      "t": [0, 0, 0],
      "r": [0, 0, 0, 1]
    },
    "anchor20": {
      "t": [0, 0, 0],
      "r": [0, 0, 0, 1]
    },
    "anchor21": {
      "t": [0, 0, 0],
      "r": [0, 0, 0, 1]
    },
    "anchor22": {
      "t": [0, 0, 0],
      "r": [0, 0, 0, 1]
    },
    "anchor23": {
      "t": [0, 0, 0],
      "r": [0, 0, 0, 1]
    },
    "anchor24": {
      "t": [0, 0, 0],
      "r": [0, 0, 0, 1]
    },
    "anchor25": {
      "t": [0, 0, 0],
      "r": [0, 0, 0, 1]
    },
    "anchor26": {
      "t": [0, 0, 0],
      "r": [0, 0, 0, 1]
    },
    "anchor27": {
      "t": [0, 0, 0],
      "r": [0, 0, 0, 1]
    },
    "anchor28": {
      "t": [0, 0, 0],
      "r": [0, 0, 0, 1]
    },
    "anchor29": {
      "t": [0, 0, 0],
      "r": [0, 0, 0, 1]
    },
    "anchor30": {
      "t": [0, 0, 0],
      "r": [0, 0, 0, 1]
    },
    "anchor31": {
      "t": [0, 0, 0],
      "r": [0, 0, 0, 1]
    },
    "anchor32": {
      "t": [0, 0, 0],
      "r": [0, 0, 0, 1]
    }
  },
  "collision": {
    "mode": "override",
    "colliders": []
  }
}
