{
  "format": "raa.prims",
  "version": 0,
  "id": "ellipsoid-roundbox",
  "name": "Ellipsoid And Round Box",
  "budget": {
    "triangles": 1500,
    "segments": 16
  },
  "nodes": [
    {
      "id": "blob",
      "kind": "ellipsoid",
      "params": {
        "radii": [0.6, 0.35, 0.45]
      },
      "transform": {
        "t": [-1.2, 0.4, 0],
        "r": [0, 0, 0, 1],
        "s": [1, 1, 1]
      },
      "material": "blob_green",
      "op": "union"
    },
    {
      "id": "pod",
      "kind": "roundBox",
      "params": {
        "size": [0.8, 0.5, 0.6],
        "radius": 0.12
      },
      "transform": {
        "t": [1.3, 0.3, 0],
        "r": [0, 0, 0, 1],
        "s": [1, 1, 1]
      },
      "material": "pod_orange",
      "op": "union"
    }
  ],
  "materials": {
    "blob_green": {
      "color": [0.15, 0.9, 0.35],
      "roughness": 0.4,
      "metallic": 0,
      "emissive": [0, 0, 0]
    },
    "pod_orange": {
      "color": [1, 0.45, 0.08],
      "roughness": 0.5,
      "metallic": 0.1,
      "emissive": [0.2, 0.05, 0]
    }
  },
  "anchors": {
    "grab": {
      "t": [1.3, 0.55, 0],
      "r": [0, 0, 0, 1]
    },
    "spawn": {
      "t": [0, 0, 0],
      "r": [0, 0, 0, 1]
    }
  },
  "collision": {
    "mode": "derived",
    "colliders": [
      {
        "node": "blob",
        "shape": "cuboid",
        "params": {
          "halfExtents": [0.6, 0.35, 0.45]
        },
        "t": [-1.2, 0.4, 0],
        "r": [0, 0, 0, 1]
      },
      {
        "node": "pod",
        "shape": "roundCuboid",
        "params": {
          "halfExtents": [0.28, 0.13, 0.18],
          "borderRadius": 0.12
        },
        "t": [1.3, 0.3, 0],
        "r": [0, 0, 0, 1]
      }
    ]
  }
}
