{
  "format": "raa.prims",
  "version": 0,
  "id": "two-cutters",
  "name": "Two cutters",
  "budget": {
    "triangles": 1500,
    "segments": 16
  },
  "nodes": [
    {
      "id": "block",
      "kind": "box",
      "params": {
        "size": [4, 1, 1]
      },
      "transform": {
        "t": [0, 0, 0],
        "r": [0, 0, 0, 1],
        "s": [1, 1, 1]
      },
      "material": "stone",
      "op": "union",
      "children": [
        {
          "id": "scoop",
          "kind": "sphere",
          "params": {
            "radius": 0.4
          },
          "transform": {
            "t": [-1, 0.5, 0],
            "r": [0, 0, 0, 1],
            "s": [1, 1, 1]
          },
          "material": "stone",
          "op": "subtract"
        },
        {
          "id": "bore",
          "kind": "cylinder",
          "params": {
            "height": 1.2,
            "radius": 0.3
          },
          "transform": {
            "t": [1, 0, 0],
            "r": [0, 0, 0, 1],
            "s": [1, 1, 1]
          },
          "material": "stone",
          "op": "subtract"
        }
      ]
    }
  ],
  "materials": {
    "stone": {
      "color": [0.5, 0.5, 0.5],
      "roughness": 0.6,
      "metallic": 0,
      "emissive": [0, 0, 0]
    }
  },
  "anchors": {},
  "collision": {
    "mode": "derived",
    "colliders": [
      {
        "node": "block",
        "shape": "cuboid",
        "params": {
          "halfExtents": [2, 0.5, 0.5]
        },
        "t": [0, 0, 0],
        "r": [0, 0, 0, 1]
      }
    ]
  }
}
